{
  "$schema": "https://json-schema.org/draft/2020-12/schema",
  "$id": "https://schemas.example.com/tooling/tool-descriptor/1",
  "title": "Tool descriptor (EA-STD-TOOL-001)",
  "description": "The normative shape of a tool descriptor. Structural rules only: prose quality, risk-tier accuracy, and annotation honesty are checked by tools/lint-descriptors.py and at review.",
  "type": "object",
  "required": ["name", "title", "description", "inputSchema", "outputSchema", "annotations", "_meta"],
  "additionalProperties": false,
  "properties": {
    "name": {
      "type": "string",
      "pattern": "^[a-z][a-z0-9_]{2,63}$",
      "description": "TS-NAM-01. Globally unique, permanent, lowercase, underscore-separated."
    },
    "title": {
      "type": "string",
      "minLength": 3,
      "maxLength": 60,
      "description": "TS-NAM-07. Human-readable label for approval and audit surfaces."
    },
    "description": {
      "type": "string",
      "minLength": 120,
      "maxLength": 2000,
      "description": "TS-DSC-01/02. The model-facing prose contract, seven parts, plain prose."
    },
    "inputSchema": { "$ref": "#/$defs/toolSchema" },
    "outputSchema": { "$ref": "#/$defs/toolSchema" },
    "annotations": {
      "type": "object",
      "required": ["readOnlyHint", "destructiveHint", "idempotentHint", "openWorldHint"],
      "additionalProperties": false,
      "description": "TS-ANN-01. All four stated explicitly, even at their defaults.",
      "properties": {
        "readOnlyHint": { "type": "boolean", "description": "True when the tool changes nothing anywhere." },
        "destructiveHint": { "type": "boolean", "description": "True when a change may be irreversible or overwrite state." },
        "idempotentHint": { "type": "boolean", "description": "True when repeating the identical call has no additional effect." },
        "openWorldHint": { "type": "boolean", "description": "True when the tool reaches outside the firm's controlled domain." }
      }
    },
    "icons": {
      "type": "array",
      "maxItems": 4,
      "description": "TS-NAM-10. Decorative only; no control may depend on an icon.",
      "items": {
        "type": "object",
        "required": ["src", "mimeType"],
        "additionalProperties": false,
        "properties": {
          "src": { "type": "string", "maxLength": 512, "description": "Icon location or data URI." },
          "mimeType": { "type": "string", "maxLength": 64, "description": "Icon media type; SVG preferred." },
          "theme": { "type": "string", "enum": ["light", "dark"], "description": "Which theme this variant is for." },
          "sizes": { "type": "array", "maxItems": 8, "items": { "type": "string", "maxLength": 16 }, "description": "Rendered sizes this variant suits." }
        }
      }
    },
    "_meta": {
      "type": "object",
      "minProperties": 1,
      "description": "Namespaced out-of-band metadata. Never rendered into the model's context.",
      "patternProperties": {
        "^[a-z0-9-]+(\\.[a-z0-9-]+)+/governance$": { "$ref": "#/$defs/governance" }
      }
    }
  },
  "$defs": {
    "toolSchema": {
      "type": "object",
      "required": ["type", "properties", "additionalProperties"],
      "description": "TS-INP-01 / TS-OUT-01. A closed object schema in the profile of §7.1.",
      "properties": {
        "type": { "const": "object" },
        "properties": { "type": "object" },
        "required": { "type": "array", "items": { "type": "string" } },
        "additionalProperties": { "const": false },
        "$defs": { "type": "object" }
      }
    },
    "governance": {
      "type": "object",
      "required": ["version", "lifecycle", "conformanceLevel", "riskTier", "owner",
                   "dataClassification", "containsPii", "entitlements", "approval",
                   "recordKeeping", "rateLimit"],
      "properties": {
        "version": { "type": "string", "pattern": "^[0-9]+\\.[0-9]+\\.[0-9]+$", "description": "TS-VER-01. Semantic version of the contract." },
        "lifecycle": { "enum": ["draft", "active", "deprecated", "retired"], "description": "Catalogue state." },
        "conformanceLevel": { "enum": ["L0", "L1", "L2", "L3"], "description": "§1.3. Asserted by the owner, verified at certification." },
        "riskTier": { "type": "integer", "minimum": 0, "maximum": 3, "description": "§9.3. Drives approval, monitoring, and evidence requirements." },
        "owner": {
          "type": "object",
          "required": ["team", "contact", "escalation"],
          "properties": {
            "team": { "type": "string", "maxLength": 64, "description": "Owning team." },
            "contact": { "type": "string", "maxLength": 128, "description": "Team mailbox." },
            "escalation": { "type": "string", "maxLength": 128, "description": "Paging escalation path." }
          }
        },
        "dataClassification": { "enum": ["public", "internal", "customer-confidential", "restricted"], "description": "Highest classification the tool can return." },
        "containsPii": { "type": "boolean", "description": "Whether results can contain personal data." },
        "piiFields": { "type": "array", "maxItems": 50, "items": { "type": "string", "maxLength": 200 }, "description": "JSON Pointers into the output schema, for mechanical masking and retention." },
        "entitlements": { "type": "array", "maxItems": 10, "items": { "type": "string", "pattern": "^[a-z0-9-]+:[a-z0-9-]+:[a-z0-9-]+$" }, "description": "Scopes the principal must hold." },
        "approval": {
          "type": "object",
          "required": ["mode"],
          "properties": {
            "mode": { "enum": ["none", "notify", "confirm", "dualControl", "humanExecution"], "description": "§9.4." },
            "confirmationTemplate": { "type": "string", "maxLength": 2000, "description": "TS-ANN-04. Rendered with validated arguments for the principal." },
            "expiresInSeconds": { "type": "integer", "minimum": 10, "maximum": 900, "description": "TS-ANN-06. Approval validity window." }
          }
        },
        "recordKeeping": {
          "type": "object",
          "required": ["auditEvent", "retention"],
          "properties": {
            "auditEvent": { "type": "string", "maxLength": 64, "description": "Audit event name emitted on every invocation." },
            "retention": { "type": "string", "pattern": "^P", "description": "ISO 8601 retention duration, e.g. P6Y." },
            "regulatoryBasis": { "type": "array", "maxItems": 10, "items": { "type": "string", "maxLength": 64 }, "description": "Obligations driving the retention." }
          }
        },
        "cost": {
          "type": "object",
          "properties": {
            "class": { "enum": ["low", "medium", "high", "async"], "description": "§10.5 latency class." },
            "p95LatencyMs": { "type": "integer", "minimum": 1, "description": "Declared p95, monitored against reality." },
            "unitCost": { "type": "string", "maxLength": 32, "description": "Marginal cost per invocation, where material." }
          }
        },
        "rateLimit": {
          "type": "object",
          "required": ["perPrincipalPerMinute"],
          "properties": {
            "perPrincipalPerMinute": { "type": "integer", "minimum": 1, "description": "TS-GOV-04." },
            "perTenantPerMinute": { "type": "integer", "minimum": 1, "description": "Tenant-level ceiling." },
            "burst": { "type": "integer", "minimum": 1, "description": "Permitted burst above the steady rate." }
          }
        },
        "dependencies": { "type": "array", "maxItems": 20, "items": { "type": "string", "maxLength": 64 }, "description": "Systems of record, by business-capability name." },
        "availability": {
          "type": "object",
          "properties": {
            "slo": { "type": "string", "maxLength": 16, "description": "Availability objective." },
            "killSwitch": { "type": "string", "maxLength": 128, "description": "TS-SEC-12. Switch identifier." },
            "degradedMode": { "type": "string", "maxLength": 240, "description": "What the tool does when a dependency is down, or that it fails closed." }
          }
        },
        "evaluation": {
          "type": "object",
          "required": ["suite", "lastRunAt"],
          "properties": {
            "suite": { "type": "string", "maxLength": 128, "description": "Where the evaluation suite lives." },
            "lastRunAt": { "type": "string", "format": "date-time", "description": "When it last ran." },
            "selectionAccuracy": { "type": "number", "minimum": 0, "maximum": 1, "description": "§27.3." },
            "refusalAccuracy": { "type": "number", "minimum": 0, "maximum": 1, "description": "§27.3." }
          }
        },
        "deprecation": {
          "type": "object",
          "required": ["since", "sunset", "successor"],
          "properties": {
            "since": { "type": "string", "format": "date", "description": "When deprecation was announced." },
            "sunset": { "type": "string", "format": "date", "description": "When the tool is retired." },
            "successor": { "type": "string", "maxLength": 64, "description": "Replacement tool name." },
            "migrationNote": { "type": "string", "maxLength": 500, "description": "What a consumer must change." }
          }
        }
      }
    }
  }
}
